{"$schema":"https://json-schema.org/draft/2020-12/schema","$id":"https://github.com/newcovid/nonebot-plugin-yijing/data/schemas/relations.schema.json","title":"relations","description":"Hexagram relation graph records.","type":"array","items":{"type":"object","additionalProperties":true,"required":["hexagram_seq","relation","target_seq","note"],"properties":{"hexagram_seq":{"type":"integer","minimum":1,"maximum":64},"relation":{"type":"string","enum":["opposite","inverse","nuclear"]},"target_seq":{"type":"integer","minimum":1,"maximum":64},"note":{"type":"string"}}}}
